symbol,price,marketCap,beta,lastDividend,range,change,changePercentage,volume,averageVolume,companyName,currency,cik,isin,cusip,exchangeFullName,exchange,industry,website,description,ceo,sector,country,fullTimeEmployees,phone,address,city,state,zip,image,ipoDate,defaultImage,isEtf,isActivelyTrading,isAdr,isFund
AAPL,247.65,3659363764480.9995,1.093,1.03,169.21-288.62,0.95,0.38508,54151253,46047281,Apple Inc.,USD,0000320193,US0378331005,037833100,NASDAQ Global Select,NASDAQ,Consumer Electronics,https://www.apple.com,"Apple Inc. designs, manufactures, and markets smartphones, personal computers, tablets, wearables, and accessories worldwide. The company offers iPhone, a line of smartphones; Mac, a line of personal computers; iPad, a line of multi-purpose tablets; and wearables, home, and accessories comprising AirPods, Apple TV, Apple Watch, Beats products, and HomePod. It also provides AppleCare support and cloud services; and operates various platforms, including the App Store that allow customers to discover and download applications and digital content, such as books, music, video, games, and podcasts, as well as advertising services include third-party licensing arrangements and its own advertising platforms. In addition, the company offers various subscription-based services, such as Apple Arcade, a game subscription service; Apple Fitness+, a personalized fitness service; Apple Music, which offers users a curated listening experience with on-demand radio stations; Apple News+, a subscription news and magazine service; Apple TV+, which offers exclusive original content; Apple Card, a co-branded credit card; and Apple Pay, a cashless payment service, as well as licenses its intellectual property. The company serves consumers, and small and mid-sized businesses; and the education, enterprise, and government markets. It distributes third-party applications for its products through the App Store. The company also sells its products through its retail and online stores, and direct sales force; and third-party cellular network carriers, wholesalers, retailers, and resellers. Apple Inc. was founded in 1976 and is headquartered in Cupertino, California.",Timothy D. Cook,Technology,US,164000,(408) 996-1010,One Apple Park Way,Cupertino,CA,95014,https://images.financialmodelingprep.com/symbol/AAPL.png,1980-12-12,False,False,True,False,False
MSFT,444.11,3301143477055.0005,1.073,3.4,344.79-555.45,-10.41,-2.29033,37424042,24331393,Microsoft Corporation,USD,0000789019,US5949181045,594918104,NASDAQ Global Select,NASDAQ,Software - Infrastructure,https://www.microsoft.com,"Microsoft Corporation develops, licenses, and supports software, services, devices, and solutions worldwide. The company operates in three segments: Productivity and Business Processes, Intelligent Cloud, and More Personal Computing. The Productivity and Business Processes segment offers Office, Exchange, SharePoint, Microsoft Teams, Office 365 Security and Compliance, Microsoft Viva, and Skype for Business; Skype, Outlook.com, OneDrive, and LinkedIn; and Dynamics 365, a set of cloud-based and on-premises business solutions for organizations and enterprise divisions. The Intelligent Cloud segment licenses SQL, Windows Servers, Visual Studio, System Center, and related Client Access Licenses; GitHub that provides a collaboration platform and code hosting service for developers; Nuance provides healthcare and enterprise AI solutions; and Azure, a cloud platform. It also offers enterprise support, Microsoft consulting, and nuance professional services to assist customers in developing, deploying, and managing Microsoft server and desktop solutions; and training and certification on Microsoft products. The More Personal Computing segment provides Windows original equipment manufacturer (OEM) licensing and other non-volume licensing of the Windows operating system; Windows Commercial, such as volume licensing of the Windows operating system, Windows cloud services, and other Windows commercial offerings; patent licensing; and Windows Internet of Things. It also offers Surface, PC accessories, PCs, tablets, gaming and entertainment consoles, and other devices; Gaming, including Xbox hardware, and Xbox content and services; video games and third-party video game royalties; and Search, including Bing and Microsoft advertising. The company sells its products through OEMs, distributors, and resellers; and directly through digital marketplaces, online stores, and retail stores. Microsoft Corporation was founded in 1975 and is headquartered in Redmond, Washington.",Satya Nadella,Technology,US,228000,425 882 8080,One Microsoft Way,Redmond,WA,98052-6399,https://images.financialmodelingprep.com/symbol/MSFT.png,1986-03-13,False,False,True,False,False
AMZN,231.31,2472750162000.0,1.376,0.0,161.38-258.6,0.31,0.1342,46594728,44775045,"Amazon.com, Inc.",USD,0001018724,US0231351067,023135106,NASDAQ Global Select,NASDAQ,Specialty Retail,https://www.amazon.com,"Amazon.com, Inc. engages in the retail sale of consumer products and subscriptions through online and physical stores in North America and internationally. The company operates through three segments: North America, International, and Amazon Web Services (AWS). Its products offered through its stores include merchandise and content purchased for resale; and products offered by third-party sellers The company also manufactures and sells electronic devices, including Kindle, Fire tablets, Fire TVs, Rings, Blink, eero, and Echo; and develops and produces media content. In addition, it offers programs that enable sellers to sell their products in its stores; and programs that allow authors, musicians, filmmakers, Twitch streamers, skill and app developers, and others to publish and sell content. Further, the company provides compute, storage, database, analytics, machine learning, and other services, as well as fulfillment, advertising, and digital content subscriptions. Additionally, it offers Amazon Prime, a membership program. The company serves consumers, sellers, developers, enterprises, content creators, and advertisers. Amazon.com, Inc. was incorporated in 1994 and is headquartered in Seattle, Washington.",Andrew R. Jassy,Consumer Cyclical,US,1560000,206 266 1000,410 Terry Avenue North,Seattle,WA,98109-5210,https://images.financialmodelingprep.com/symbol/AMZN.png,1997-05-15,False,False,True,False,False
GOOGL,328.38,3962768662526.0,1.086,0.83,140.53-340.49,6.38,1.98137,35014518,36694673,Alphabet Inc.,USD,0001652044,US02079K3059,02079K305,NASDAQ Global Select,NASDAQ,Internet Content & Information,https://www.abc.xyz,"Alphabet Inc. provides various products and platforms in the United States, Europe, the Middle East, Africa, the Asia-Pacific, Canada, and Latin America. It operates through Google Services, Google Cloud, and Other Bets segments. The Google Services segment offers products and services, including ads, Android, Chrome, hardware, Gmail, Google Drive, Google Maps, Google Photos, Google Play, Search, and YouTube. It is also involved in the sale of apps and in-app purchases and digital content in the Google Play store; and Fitbit wearable devices, Google Nest home products, Pixel phones, and other devices, as well as in the provision of YouTube non-advertising services. The Google Cloud segment offers infrastructure, platform, and other services; Google Workspace that include cloud-based collaboration tools for enterprises, such as Gmail, Docs, Drive, Calendar, and Meet; and other services for enterprise customers. The Other Bets segment sells health technology and internet services. The company was founded in 1998 and is headquartered in Mountain View, California.",Sundar Pichai,Technology,US,185719,650 253 0000,1600 Amphitheatre Parkway,Mountain View,CA,94043,https://images.financialmodelingprep.com/symbol/GOOGL.png,2004-08-19,False,False,True,False,False
META,612.96,1545017852703.0,1.287,2.1,479.8-796.25,8.84,1.46329,14439157,18721865,"Meta Platforms, Inc.",USD,0001326801,US30303M1027,30303M102,NASDAQ Global Select,NASDAQ,Internet Content & Information,https://investor.fb.com,"Meta Platforms, Inc. engages in the development of products that enable people to connect and share with friends and family through mobile devices, personal computers, virtual reality headsets, and wearables worldwide. It operates in two segments, Family of Apps and Reality Labs. The Family of Apps segment offers Facebook, which enables people to share, discuss, discover, and connect with interests; Instagram, a community for sharing photos, videos, and private messages, as well as feed, stories, reels, video, live, and shops; Messenger, a messaging application for people to connect with friends, family, communities, and businesses across platforms and devices through text, audio, and video calls; and WhatsApp, a messaging application that is used by people and businesses to communicate and transact privately. The Reality Labs segment provides augmented and virtual reality related products comprising consumer hardware, software, and content that help people feel connected, anytime, and anywhere. The company was formerly known as Facebook, Inc. and changed its name to Meta Platforms, Inc. in October 2021. Meta Platforms, Inc. was incorporated in 2004 and is headquartered in Menlo Park, California.",Mark Elliot Zuckerberg,Technology,US,76834,650 543 4800,1601 Willow Road,Menlo Park,CA,94025,https://images.financialmodelingprep.com/symbol/META.png,2012-05-18,False,False,True,False,False
